{
  "boundary": {
    "backend_api_closed": true,
    "crawler_input_forbidden": true,
    "formula_weights_exposed": false,
    "html_presentation_input_forbidden": true,
    "no_forecast": true,
    "no_investment_recommendation": true,
    "no_live_adapter_claim": true,
    "no_price_target": true,
    "no_trading_signal": true,
    "no_true_live_feed_claim": true,
    "orion_core_protected": true,
    "payment_closed": true,
    "read_only": true,
    "refresh_pipeline_binding_opened": true,
    "runtime_closed": true,
    "static_public_snapshot": true,
    "ui_binding_opened": true
  },
  "comparison_status": "FULL_COMPARABLE",
  "current_snapshot_id": "crypto-astro:2026-10-14T04:51:28Z:1751161c8064",
  "generated_at_utc": "2026-10-14T04:51:28Z",
  "metrics": {
    "alt_breadth_24h_pct": {
      "current_value": "50.0",
      "delta_unit": "percentage_points",
      "direction": "UP",
      "display_delta": "+32.4",
      "display_precision": 1,
      "methodology_id": "top250_nonstable_ex_btc_positive_breadth_24h_v0_1",
      "path": "altcoin_rotation.alt_breadth_24h_pct",
      "previous_value": "17.6",
      "proof_sources": [
        "coingecko_top250_markets"
      ],
      "raw_delta": "32.4",
      "status": "COMPARABLE",
      "type": "NUMERIC",
      "unit": "percent"
    },
    "alt_breadth_7d_pct": {
      "current_value": "36.6",
      "delta_unit": "percentage_points",
      "direction": "UP",
      "display_delta": "+12.2",
      "display_precision": 1,
      "methodology_id": "top250_nonstable_ex_btc_positive_breadth_7d_v0_1",
      "path": "altcoin_rotation.alt_breadth_7d_pct",
      "previous_value": "24.4",
      "proof_sources": [
        "coingecko_top250_markets"
      ],
      "raw_delta": "12.2",
      "status": "COMPARABLE",
      "type": "NUMERIC",
      "unit": "percent"
    },
    "btc_gravity_pct": {
      "current_value": "59.28821051488745",
      "delta_unit": "percentage_points",
      "direction": "DOWN",
      "display_delta": "-0.06",
      "display_precision": 2,
      "methodology_id": "coingecko_global_btc_dominance_direct_v0_1",
      "path": "market_reality.btc_dominance_pct",
      "previous_value": "59.34656603932792",
      "proof_sources": [
        "coingecko_global"
      ],
      "raw_delta": "-0.05835552444047",
      "status": "COMPARABLE",
      "type": "NUMERIC",
      "unit": "percent"
    },
    "defi_tvl_usd": {
      "current_value": "91321661668.0",
      "delta_unit": "usd",
      "direction": "UP",
      "display_delta": "+707126501",
      "display_precision": 0,
      "methodology_id": "defillama_historical_chain_tvl_ex_double_count_v0_1",
      "path": "liquidity_tvl.defi_tvl_usd",
      "previous_value": "90614535167.0",
      "proof_sources": [
        "defillama_tvl_methodology_source"
      ],
      "raw_delta": "707126501.0",
      "status": "COMPARABLE",
      "type": "NUMERIC",
      "unit": "usd"
    },
    "liquidity_context_state": {
      "current_value": "context fresh",
      "methodology_id": "liquidity_context_state_with_global_ex_double_count_tvl_v0_1",
      "path": "liquidity_tvl.liquidity_context_state",
      "previous_value": "context fresh",
      "proof_sources": [
        "defi_tvl_usd"
      ],
      "status": "COMPARABLE",
      "transition": "UNCHANGED",
      "type": "CATEGORICAL",
      "unit": "state"
    },
    "market_field_score": {
      "current_value": "91.0",
      "delta_unit": "score_points",
      "direction": "UP",
      "display_delta": "+17.0",
      "display_precision": 1,
      "methodology_id": "public_market_field_score_v0_1",
      "path": "field_output.market_field_score",
      "previous_value": "74.0",
      "proof_sources": [
        "coingecko_global",
        "coingecko_top250_markets",
        "defillama_stablecoins"
      ],
      "raw_delta": "17.0",
      "status": "COMPARABLE",
      "type": "NUMERIC",
      "unit": "score_0_100"
    },
    "regime_label": {
      "current_value": "Balanced Expansion",
      "methodology_id": "public_regime_threshold_58_v0_1",
      "path": "field_output.regime_label",
      "previous_value": "Balanced Expansion",
      "proof_sources": [
        "coingecko_global",
        "coingecko_top250_markets",
        "defillama_stablecoins"
      ],
      "status": "COMPARABLE",
      "transition": "UNCHANGED",
      "type": "CATEGORICAL",
      "unit": "state"
    },
    "stablecoin_share_pct": {
      "current_value": "11.029869480566624",
      "delta_unit": "percentage_points",
      "direction": "DOWN",
      "display_delta": "-0.17",
      "display_precision": 2,
      "methodology_id": "stablecoin_share_prefer_llama_then_coingecko_over_total_cap_v0_1",
      "path": "market_reality.stablecoin_share_pct",
      "previous_value": "11.195556034503005",
      "proof_sources": [
        "defillama_stablecoins",
        "coingecko_global"
      ],
      "raw_delta": "-0.165686553936381",
      "status": "COMPARABLE",
      "type": "NUMERIC",
      "unit": "percent"
    }
  },
  "previous_snapshot_id": "crypto-astro:2026-10-13T03:32:58Z:b3f953aaa57c",
  "schema_version": "crypto_astro_snapshot_delta_public_v0_2",
  "unavailable_metrics": {}
}
